{
  "claim_ids": [],
  "display_order": 5,
  "evidence_ids": [],
  "freshness": {},
  "linked_source_ids": [],
  "measurement_ids": [],
  "question": "How much computation can foveated rendering save without visible artifacts?",
  "question_id": "question-foveated-rendering",
  "schema_version": "prepared_question_v1",
  "scope": {
    "space_name": "graphics"
  },
  "status": "active",
  "synthesis": {},
  "warnings": []
}
